{
  "$schema": "https://json-schema.org/draft/2020-12/schema",
  "title": "Free Tools Directory Entry",
  "type": "object",
  "required": ["name", "category", "url", "access", "last_verified"],
  "properties": {
    "name": {"type": "string", "minLength": 1},
    "category": {"type": "string", "minLength": 1},
    "url": {"type": "string", "format": "uri"},
    "official_docs": {"type": "string", "format": "uri"},
    "access": {"enum": ["free", "open-source", "free-tier", "credits", "mixed", "unknown"]},
    "free_limit": {"type": "string"},
    "paid_after": {"type": "string"},
    "self_hostable": {"type": "boolean"},
    "requires_payment": {"enum": [true, false, "sometimes"]},
    "last_verified": {"type": "string", "format": "date"},
    "notes": {"type": "string"}
  },
  "additionalProperties": false
}
